{
	"registryId": "amber.distributed-governance.contract-registry",
	"registryVersion": "1.1.0",
	"sourceBaseline": "docs/architecture/distributed-governance-baseline.md",
	"authorityBoundaries": {
		"repositoryLocalAuthority": true,
		"offlineCapability": true,
		"executesAnything": false
	},
	"versionDomains": [
		{
			"id": "runtime-protocol",
			"title": "Runtime Protocol",
			"currentVersion": "1.0.0",
			"deprecatedVersions": [
				"0.9.0"
			],
			"refusedVersions": [
				"0.8.0"
			]
		},
		{
			"id": "contract-schema",
			"title": "Contract and Schema",
			"currentVersion": "1.0.0",
			"deprecatedVersions": [
				"0.9.0"
			],
			"refusedVersions": [
				"0.8.0"
			]
		},
		{
			"id": "capability",
			"title": "Capability",
			"currentVersion": "1.0.0",
			"deprecatedVersions": [
				"0.9.0"
			],
			"refusedVersions": [
				"0.8.0"
			]
		},
		{
			"id": "projection-rule",
			"title": "Projection Rule",
			"currentVersion": "1.0.0",
			"deprecatedVersions": [
				"0.9.0"
			],
			"refusedVersions": [
				"0.8.0"
			]
		},
		{
			"id": "component-generation",
			"title": "Component Generation",
			"currentVersion": "1.0.0",
			"deprecatedVersions": [
				"0.9.0"
			],
			"refusedVersions": [
				"0.8.0"
			]
		},
		{
			"id": "source-generation",
			"title": "Source Generation",
			"currentVersion": "1.0.0",
			"deprecatedVersions": [
				"0.9.0"
			],
			"refusedVersions": [
				"0.8.0"
			]
		}
	],
	"boundedContexts": [
		{
			"id": "amber-core",
			"title": "Amber Core"
		},
		{
			"id": "sync-runtime",
			"title": "Sync Runtime"
		},
		{
			"id": "governance-graph",
			"title": "Governance Graph"
		},
		{
			"id": "governed-knowledge-base",
			"title": "Governed Knowledge Base"
		},
		{
			"id": "visualization-workbench",
			"title": "Visualization Workbench"
		},
		{
			"id": "organization-control-plane",
			"title": "Organization Control Plane"
		}
	],
	"entries": [
		{
			"id": "amber.distributed-governance.contract.sync-envelope",
			"kind": "contract",
			"title": "Sync Envelope",
			"versionDomain": "runtime-protocol",
			"owningContext": "sync-runtime",
			"version": "1.0.0",
			"disposition": "supported",
			"bindings": {
				"schema": "contract-schema:1.0.0",
				"type": "runtime-protocol:1.0.0",
				"capability": "capability:1.0.0",
				"projectionRule": "projection-rule:1.0.0",
				"componentGeneration": "component-generation:1.0.0",
				"sourceGeneration": "source-generation:1.0.0"
			}
		},
		{
			"id": "amber.distributed-governance.contract.domain-fact",
			"kind": "contract",
			"title": "Domain Fact",
			"versionDomain": "contract-schema",
			"owningContext": "amber-core",
			"version": "1.0.0",
			"disposition": "supported",
			"bindings": {
				"schema": "contract-schema:1.0.0",
				"type": "runtime-protocol:1.0.0",
				"capability": "capability:1.0.0",
				"projectionRule": "projection-rule:1.0.0",
				"componentGeneration": "component-generation:1.0.0",
				"sourceGeneration": "source-generation:1.0.0"
			}
		},
		{
			"id": "amber.distributed-governance.contract.domain-event",
			"kind": "contract",
			"title": "Domain Event",
			"versionDomain": "contract-schema",
			"owningContext": "amber-core",
			"version": "1.0.0",
			"disposition": "supported",
			"bindings": {
				"schema": "contract-schema:1.0.0",
				"type": "runtime-protocol:1.0.0",
				"capability": "capability:1.0.0",
				"projectionRule": "projection-rule:1.0.0",
				"componentGeneration": "component-generation:1.0.0",
				"sourceGeneration": "source-generation:1.0.0"
			}
		},
		{
			"id": "amber.distributed-governance.contract.sync-control-record",
			"kind": "contract",
			"title": "Sync Control Record",
			"versionDomain": "runtime-protocol",
			"owningContext": "sync-runtime",
			"version": "1.0.0",
			"disposition": "supported",
			"bindings": {
				"schema": "contract-schema:1.0.0",
				"type": "runtime-protocol:1.0.0",
				"capability": "capability:1.0.0",
				"projectionRule": "projection-rule:1.0.0",
				"componentGeneration": "component-generation:1.0.0",
				"sourceGeneration": "source-generation:1.0.0"
			}
		},
		{
			"id": "amber.distributed-governance.contract.sync-session",
			"kind": "contract",
			"title": "Sync Session",
			"versionDomain": "runtime-protocol",
			"owningContext": "sync-runtime",
			"version": "1.0.0",
			"disposition": "supported",
			"bindings": {
				"schema": "contract-schema:1.0.0",
				"type": "runtime-protocol:1.0.0",
				"capability": "capability:1.0.0",
				"projectionRule": "projection-rule:1.0.0",
				"componentGeneration": "component-generation:1.0.0",
				"sourceGeneration": "source-generation:1.0.0"
			}
		},
		{
			"id": "amber.distributed-governance.contract.sync-operation",
			"kind": "contract",
			"title": "Sync Operation",
			"versionDomain": "runtime-protocol",
			"owningContext": "sync-runtime",
			"version": "1.0.0",
			"disposition": "supported",
			"bindings": {
				"schema": "contract-schema:1.0.0",
				"type": "runtime-protocol:1.0.0",
				"capability": "capability:1.0.0",
				"projectionRule": "projection-rule:1.0.0",
				"componentGeneration": "component-generation:1.0.0",
				"sourceGeneration": "source-generation:1.0.0"
			}
		},
		{
			"id": "amber.distributed-governance.contract.checkpoint",
			"kind": "contract",
			"title": "Checkpoint",
			"versionDomain": "runtime-protocol",
			"owningContext": "sync-runtime",
			"version": "1.0.0",
			"disposition": "supported",
			"bindings": {
				"schema": "contract-schema:1.0.0",
				"type": "runtime-protocol:1.0.0",
				"capability": "capability:1.0.0",
				"projectionRule": "projection-rule:1.0.0",
				"componentGeneration": "component-generation:1.0.0",
				"sourceGeneration": "source-generation:1.0.0"
			}
		},
		{
			"id": "amber.distributed-governance.contract.ownership-handoff",
			"kind": "contract",
			"title": "Ownership Handoff",
			"versionDomain": "runtime-protocol",
			"owningContext": "sync-runtime",
			"version": "1.0.0",
			"disposition": "supported",
			"bindings": {
				"schema": "contract-schema:1.0.0",
				"type": "runtime-protocol:1.0.0",
				"capability": "capability:1.0.0",
				"projectionRule": "projection-rule:1.0.0",
				"componentGeneration": "component-generation:1.0.0",
				"sourceGeneration": "source-generation:1.0.0"
			}
		},
		{
			"id": "amber.distributed-governance.contract.conflict",
			"kind": "contract",
			"title": "Conflict",
			"versionDomain": "contract-schema",
			"owningContext": "sync-runtime",
			"version": "1.0.0",
			"disposition": "supported",
			"bindings": {
				"schema": "contract-schema:1.0.0",
				"type": "runtime-protocol:1.0.0",
				"capability": "capability:1.0.0",
				"projectionRule": "projection-rule:1.0.0",
				"componentGeneration": "component-generation:1.0.0",
				"sourceGeneration": "source-generation:1.0.0"
			}
		},
		{
			"id": "amber.distributed-governance.contract.resolution",
			"kind": "contract",
			"title": "Resolution",
			"versionDomain": "contract-schema",
			"owningContext": "amber-core",
			"version": "1.0.0",
			"disposition": "supported",
			"bindings": {
				"schema": "contract-schema:1.0.0",
				"type": "runtime-protocol:1.0.0",
				"capability": "capability:1.0.0",
				"projectionRule": "projection-rule:1.0.0",
				"componentGeneration": "component-generation:1.0.0",
				"sourceGeneration": "source-generation:1.0.0"
			}
		},
		{
			"id": "amber.distributed-governance.contract.rejection",
			"kind": "contract",
			"title": "Rejection",
			"versionDomain": "contract-schema",
			"owningContext": "sync-runtime",
			"version": "1.0.0",
			"disposition": "supported",
			"bindings": {
				"schema": "contract-schema:1.0.0",
				"type": "runtime-protocol:1.0.0",
				"capability": "capability:1.0.0",
				"projectionRule": "projection-rule:1.0.0",
				"componentGeneration": "component-generation:1.0.0",
				"sourceGeneration": "source-generation:1.0.0"
			}
		},
		{
			"id": "amber.distributed-governance.contract.corruption",
			"kind": "contract",
			"title": "Corruption",
			"versionDomain": "contract-schema",
			"owningContext": "sync-runtime",
			"version": "1.0.0",
			"disposition": "supported",
			"bindings": {
				"schema": "contract-schema:1.0.0",
				"type": "runtime-protocol:1.0.0",
				"capability": "capability:1.0.0",
				"projectionRule": "projection-rule:1.0.0",
				"componentGeneration": "component-generation:1.0.0",
				"sourceGeneration": "source-generation:1.0.0"
			}
		},
		{
			"id": "amber.distributed-governance.contract.read-snapshot",
			"kind": "contract",
			"title": "Read Snapshot",
			"versionDomain": "contract-schema",
			"owningContext": "visualization-workbench",
			"version": "1.0.0",
			"disposition": "supported",
			"bindings": {
				"schema": "contract-schema:1.0.0",
				"type": "runtime-protocol:1.0.0",
				"capability": "capability:1.0.0",
				"projectionRule": "projection-rule:1.0.0",
				"componentGeneration": "component-generation:1.0.0",
				"sourceGeneration": "source-generation:1.0.0"
			}
		},
		{
			"id": "amber.distributed-governance.contract.query-contract",
			"kind": "contract",
			"title": "Query Contract",
			"versionDomain": "contract-schema",
			"owningContext": "governance-graph",
			"version": "1.0.0",
			"disposition": "supported",
			"bindings": {
				"schema": "contract-schema:1.0.0",
				"type": "runtime-protocol:1.0.0",
				"capability": "capability:1.0.0",
				"projectionRule": "projection-rule:1.0.0",
				"componentGeneration": "component-generation:1.0.0",
				"sourceGeneration": "source-generation:1.0.0"
			}
		},
		{
			"id": "amber.distributed-governance.contract.projection-query-envelope",
			"kind": "contract",
			"title": "Projection Query Envelope",
			"versionDomain": "projection-rule",
			"owningContext": "governance-graph",
			"version": "1.0.0",
			"disposition": "supported",
			"bindings": {
				"schema": "contract-schema:1.0.0",
				"type": "runtime-protocol:1.0.0",
				"capability": "capability:1.0.0",
				"projectionRule": "projection-rule:1.0.0",